{
  "meta": {
    "project": "acme-api",
    "lang": "en",
    "ref": "main..feature/rate-limit",
    "generatedAt": "2026-08-04",
    "title": "Per-key API rate limiting",
    "stats": {
      "filesChanged": 4,
      "filesNew": 3,
      "added": 354,
      "deleted": 6,
      "attentionFiles": 2
    }
  },
  "intent": "Public API endpoints had no throttling — a single client could exhaust the service. This change adds a <b>token-bucket rate limiter</b> keyed by API key (IP as fallback): limits come from config, bucket state lives in atomic Redis counters, and a throttled request gets a <code>429</code> with <code>Retry-After</code> in the project's shared error shape. Main risks: naive get+set counters losing increments under load (closed with an atomic Lua script) and accidentally throttling health checks (closed by scoping the middleware to <code>/api/*</code>).",
  "story": [
    {
      "label": "Goal",
      "group": "docs",
      "text": "Protect the public API from a single client exhausting the service: per-key rate limiting with a token bucket, off by default in development.",
      "files": [
        "docs/rate-limiting.md"
      ]
    },
    {
      "link": "a limiter needs a decision point on the request path — that is a middleware in this codebase"
    },
    {
      "label": "Step 1 · middleware",
      "group": "core",
      "text": "New <code>rateLimit</code> middleware on the <code>/api/*</code> route group: refills the bucket from elapsed time, takes a token, sets <code>X-RateLimit-Remaining</code>. Two outcomes:",
      "branches": [
        [
          "allowed",
          "request passes through, remaining tokens reported in the response headers"
        ],
        [
          "throttled",
          "429 with Retry-After; the body follows the project-wide error shape from errorHandler"
        ]
      ],
      "files": [
        "src/middleware/rateLimit.ts",
        "src/routes/api.ts",
        "src/middleware/errorHandler.ts"
      ]
    },
    {
      "link": "counters must stay correct across instances — a naive GET+SET loses increments under concurrent load"
    },
    {
      "label": "Consequence · Redis",
      "group": "infra",
      "text": "Bucket state is an <code>INCR</code>-and-<code>EXPIRE</code> pair executed as one atomic Lua script; keys are <code>rl:{key}:{window}</code> with a TTL, so state cleans itself up.",
      "files": [
        "src/lib/redis.ts"
      ]
    },
    {
      "link": "limits differ per environment, so they come from config rather than constants"
    },
    {
      "label": "Consequence · config",
      "group": "ops",
      "text": "Two new env vars: <code>RATE_LIMIT_RPM</code> (requests per minute) and <code>RATE_LIMIT_BURST</code>. Unset RPM disables the limiter — development stays friction-free, and the rollout is a config change.",
      "files": [
        "src/config.ts"
      ]
    },
    {
      "link": "fixing the behavior"
    },
    {
      "label": "Confirmation",
      "group": "test",
      "text": "12 tests: refill math including burst, both middleware outcomes, per-key isolation, the 429 response shape, and the limiter staying off when RPM is unset.",
      "files": [
        "test/rateLimit.test.ts"
      ]
    }
  ],
  "groups": [
    {
      "id": "docs",
      "name": "Decision record",
      "role": "context",
      "tag": "Context · read first",
      "why": "Fixes the scope decisions: token bucket over sliding window (cheaper, burst-friendly), fail-open when Redis is down (availability over strictness for a public API), health checks and webhooks stay outside the limiter.",
      "files": [
        "docs/rate-limiting.md"
      ]
    },
    {
      "id": "core",
      "name": "Core: token bucket and the 429 path",
      "role": "read",
      "tag": "Cause · read carefully",
      "why": "The middleware is the decision point: refill math, key derivation (API key, IP fallback), and the throttled response. Two things worth checking by hand: the refill formula under burst, and that the 429 body reuses the shared error shape instead of inventing its own.",
      "files": [
        "src/middleware/rateLimit.ts",
        "src/routes/api.ts",
        "src/middleware/errorHandler.ts"
      ]
    },
    {
      "id": "infra",
      "name": "Redis: atomic counters",
      "role": "verify-pattern",
      "tag": "One pattern · verify atomicity",
      "why": "One new helper, one pattern to verify: the INCR+EXPIRE pair must be a single atomic script, and every key must carry a TTL — a keyless EXPIRE or a two-step counter reintroduces the race this exists to close.",
      "files": [
        "src/lib/redis.ts"
      ]
    },
    {
      "id": "ops",
      "name": "Config & rollout",
      "role": "ops",
      "tag": "Ops · deploy checklist",
      "why": "The limiter ships dark: with RATE_LIMIT_RPM unset nothing changes. Turning it on is a config-only rollout, and turning it off again is deleting one env var.",
      "files": [
        "src/config.ts"
      ]
    },
    {
      "id": "test",
      "name": "Behavior fixed by tests",
      "role": "spec",
      "tag": "Tests · collapsed",
      "collapsed": true,
      "why": "12 tests pin the refill math (including burst), both middleware outcomes, per-key isolation, the 429 shape with Retry-After, and the disabled-by-default behavior.",
      "files": [
        "test/rateLimit.test.ts"
      ]
    }
  ],
  "files": {
    "docs/rate-limiting.md": {
      "service": "docs",
      "role": "new file — scope decisions",
      "add": 84,
      "del": 0,
      "isNew": true,
      "why": "<b>Key decisions:</b> token bucket over sliding window (constant memory, burst-friendly); fail-open when Redis is unavailable — for a public API, availability wins over strict limiting; health checks and webhooks deliberately stay outside <code>/api/*</code> scope.",
      "frag": [
        [
          "ctx",
          "## Scope decisions"
        ],
        [
          "ctx",
          "- Token bucket, not sliding window: constant memory, allows bursts."
        ],
        [
          "ctx",
          "- Fail-open on Redis outage: availability over strictness."
        ],
        [
          "ctx",
          "- Health checks and webhooks are not throttled (outside /api/*)."
        ]
      ],
      "preview": [
        [
          "add",
          "Scope: token bucket, fail-open, /api/* only"
        ]
      ]
    },
    "src/middleware/rateLimit.ts": {
      "service": "backend",
      "role": "new file — the limiter",
      "add": 96,
      "del": 0,
      "isNew": true,
      "why": "<b>What happened:</b> the middleware derives the bucket key (API key, IP fallback), refills tokens from elapsed time, and either passes the request through with <code>X-RateLimit-Remaining</code> or throws a 429. <b>Review focus:</b> the refill formula caps at burst size — check the rounding; and the 429 goes through the shared <code>ApiError</code>, not a hand-rolled response.",
      "frag": [
        [
          "add",
          "const key = req.get('x-api-key') ?? req.ip;"
        ],
        [
          "add",
          "const tokens = await takeToken(redis, `rl:${key}`, config.rateLimit);"
        ],
        [
          "add",
          "if (tokens < 0) {"
        ],
        [
          "add",
          "  res.set('Retry-After', String(retryAfterSeconds));"
        ],
        [
          "add",
          "  throw new ApiError(429, 'RATE_LIMITED', 'Too many requests');"
        ],
        [
          "add",
          "}"
        ],
        [
          "add",
          "res.set('X-RateLimit-Remaining', String(tokens));"
        ]
      ],
      "preview": [
        [
          "add",
          "takeToken() → pass with headers | 429 Retry-After"
        ]
      ]
    },
    "src/routes/api.ts": {
      "service": "backend",
      "role": "wires the middleware",
      "add": 9,
      "del": 2,
      "why": "<b>What happened:</b> the limiter is mounted on the <code>/api/*</code> router group, after auth (so the key is known) and before handlers. Health and webhook routes live outside the group and stay unthrottled.",
      "frag": [
        [
          "ctx",
          "apiRouter.use(requireAuth);"
        ],
        [
          "add",
          "apiRouter.use(rateLimit(config.rateLimit));"
        ],
        [
          "ctx",
          "apiRouter.get('/projects', listProjects);"
        ]
      ],
      "preview": [
        [
          "add",
          "apiRouter.use(rateLimit(...)) after auth"
        ]
      ]
    },
    "src/middleware/errorHandler.ts": {
      "service": "backend",
      "role": "429 in the shared shape",
      "add": 14,
      "del": 3,
      "why": "<b>What happened:</b> the shared error handler learns the 429 case: it keeps <code>Retry-After</code> set by the limiter and renders the standard <code>{ code, message }</code> body, so clients parse one error shape everywhere.",
      "frag": [
        [
          "ctx",
          "if (err instanceof ApiError) {"
        ],
        [
          "add",
          "  // Retry-After is already on the response when the limiter threw."
        ],
        [
          "add",
          "  return res.status(err.status).json({ code: err.code, message: err.message });"
        ],
        [
          "ctx",
          "}"
        ]
      ],
      "preview": [
        [
          "add",
          "429 renders the standard { code, message } body"
        ]
      ]
    },
    "src/lib/redis.ts": {
      "service": "backend",
      "role": "atomic take-token helper",
      "add": 18,
      "del": 0,
      "why": "<b>What happened:</b> <code>takeToken</code> runs INCR and EXPIRE as one Lua script — the counter and its TTL can never diverge, and concurrent requests cannot lose increments. <b>Review focus:</b> the script is the whole point; a JS-side two-step would silently reintroduce the race.",
      "frag": [
        [
          "add",
          "const TAKE_TOKEN_LUA = `"